{"aggregate_id":"33333333-3333-4333-8333-333333333333","aggregate_type":"device_telemetry_stream","aggregate_version":"42","causation_id":"8a2d3d4f-6b73-4fca-9348-4a0a6d3ce7a1","correlation_id":"4d9d9d30-d209-446e-99ea-d40ab0953d0d","event_id":"0d72ff07-a646-4d41-9b5b-52c5f25e4ca8","event_type":"telemetry.recorded","occurred_at":"2026-09-21T15:00:00.125000Z","payload":{"bin_id":"55555555-5555-4555-8555-555555555555","binding_version":"3","device_id":"33333333-3333-4333-8333-333333333333","measurements":{"relative_humidity_percent":66.2,"temperature_c":28.75},"observed_at":"2026-09-21T14:59:59.500000Z","reading_id":"bb70cd06-0720-461a-8ecf-a56754985f87","received_at":"2026-09-21T15:00:00.100000Z","site_id":"22222222-2222-4222-8222-222222222222","source_message_id":"sensor-003.boot-018.reading-000042"},"schema_version":1,"tenant_id":"11111111-1111-4111-8111-111111111111","traceparent":"00-4bf92f3577b34da6a3ce929d0e0e4736-00f067aa0ba902b7-01"}
